{
    "title": "Palindrome Permutation",
    "description": "Determine if any permutation of the input string can form a palindrome.",
    "style": "text_style",
    "content": [
        {
            "type": "title",
            "text": "Palindrome Permutation"
        },
        {
            "type": "text",
            "text": "Determine if any permutation of the input string can form a palindrome."
        },
        {
            "type": "blocks",
            "blocks": [
                {
                    "id": "problem_statement",
                    "title": "Problem Statement",
                    "content": [
                        {
                            "type": "text",
                            "text": "Given a string, write a function to check if it is a permutation of a palindrome. A palindrome does not need to be limited to just dictionary words. The key property is that at most one character may have an odd frequency."
                        }
                    ]
                },
                {
                    "id": "code_example",
                    "title": "Code Example",
                    "content": [
                        {
                            "type": "code",
                            "name": "interview_lcci_01_04_palindrome_permutation"
                        }
                    ]
                },
                {
                    "id": "example_output",
                    "title": "Example Output",
                    "content": [
                        {
                            "type": "text",
                            "text": "tact coa -> true"
                        },
                        {
                            "type": "text",
                            "text": "daily -> false"
                        }
                    ]
                }
            ]
        }
    ]
}
