{
    "title": "Insert",
    "description": "Insert bits of integer M into N, replacing bits i through j.",
    "style": "text_style",
    "content": [
        {
            "type": "title",
            "text": "Insert"
        },
        {
            "type": "text",
            "text": "Insert bits of integer M into N, replacing bits i through j."
        },
        {
            "type": "blocks",
            "blocks": [
                {
                    "id": "problem_statement",
                    "title": "Problem Statement",
                    "content": [
                        {
                            "type": "text",
                            "text": "Insert bits of integer M into N, replacing bits i through j. This maps to LCCI 5.1. Typical interview angle: Clear target bits in N with a masked complement. Shift M into position and OR with cleared N. Handle edge cases when j - i + 1 equals the word width."
                        }
                    ]
                },
                {
                    "id": "code_example",
                    "title": "Code Example",
                    "content": [
                        {
                            "type": "code",
                            "name": "interview_lcci_05_01_insert"
                        }
                    ]
                },
                {
                    "id": "example_output",
                    "title": "Example Output",
                    "content": [
                        {
                            "type": "text",
                            "text": "1100"
                        },
                        {
                            "type": "text",
                            "text": "19"
                        }
                    ]
                }
            ]
        }
    ]
}
