{
    "title": "Rank From Stream",
    "description": "Read integers from a stream and support two operations: - `track(x)`: record a new number - `getRankOfNumber(x)`: return how many tracked numbers are less than or equal to `x` **Example:** ``` Input: [\"StreamRank\", \"getRankOfNumber\", \"track\", \"getRankOfNumber\"] [[], [1], [0], [0]] Output: [null, 0, null, 1] ``` **Notes:** - `x <= 50000` - At most `2000` calls are made in total.",
    "style": "text_style",
    "content": [
        {
            "type": "title",
            "text": "Rank From Stream"
        },
        {
            "type": "text",
            "text": "Read integers from a stream and support two operations: - `track(x)`: record a new number - `getRankOfNumber(x)`: return how many tracked numbers are less than or equal to `x` **Example:** ``` Input: [\"StreamRank\", \"getRankOfNumber\", \"track\", \"getRankOfNumber\"] [[], [1], [0], [0]] Output: [null, 0, null, 1] ``` **Notes:** - `x <= 50000` - At most `2000` calls are made in total."
        },
        {
            "type": "blocks",
            "blocks": [
                {
                    "id": "problem_statement",
                    "title": "Problem Statement",
                    "content": [
                        {
                            "type": "text",
                            "text": "Read integers from a stream and support two operations: - `track(x)`: record a new number - `getRankOfNumber(x)`: return how many tracked numbers are less than or equal to `x` **Example:** ``` Input: [\"StreamRank\", \"getRankOfNumber\", \"track\", \"getRankOfNumber\"] [[], [1], [0], [0]] Output: [null, 0, null, 1] ``` **Notes:** - `x <= 50000` - At most `2000` calls are made in total."
                        }
                    ]
                },
                {
                    "id": "code_example",
                    "title": "Code Example",
                    "content": [
                        {
                            "type": "code",
                            "name": "interview_lcci_10_10_rank_from_stream"
                        }
                    ]
                },
                {
                    "id": "example_output",
                    "title": "Example Output",
                    "content": [
                        {
                            "type": "text",
                            "text": "0"
                        },
                        {
                            "type": "text",
                            "text": "1"
                        }
                    ]
                }
            ]
        }
    ]
}
