{
    "title": "Get Kth Magic Number",
    "description": "A magic number is a positive integer whose prime factors are only `3`, `5`, and `7`.",
    "style": "text_style",
    "content": [
        {
            "type": "title",
            "text": "Get Kth Magic Number"
        },
        {
            "type": "text",
            "text": "A magic number is a positive integer whose prime factors are only `3`, `5`, and `7`."
        },
        {
            "type": "blocks",
            "blocks": [
                {
                    "id": "problem_statement",
                    "title": "Problem Statement",
                    "content": [
                        {
                            "type": "text",
                            "text": "A magic number is a positive integer whose prime factors are only `3`, `5`, and `7`. Design an algorithm to find the `k`th magic number. **Example 1:** ``` Input: k = 5 Output: 9 ``` **Example 2:** ``` Input: k = 1 Output: 1 ```"
                        }
                    ]
                },
                {
                    "id": "code_example",
                    "title": "Code Example",
                    "content": [
                        {
                            "type": "code",
                            "name": "interview_lcci_17_09_get_kth_magic_number"
                        }
                    ]
                },
                {
                    "id": "example_output",
                    "title": "Example Output",
                    "content": [
                        {
                            "type": "text",
                            "text": "See problem output in legacy docs."
                        }
                    ]
                }
            ]
        }
    ]
}
