{
    "title": "Three In One",
    "description": "Implement three independent stacks using a single fixed-size array.",
    "style": "text_style",
    "content": [
        {
            "type": "title",
            "text": "Three In One"
        },
        {
            "type": "text",
            "text": "Implement three independent stacks using a single fixed-size array."
        },
        {
            "type": "blocks",
            "blocks": [
                {
                    "id": "problem_statement",
                    "title": "Problem Statement",
                    "content": [
                        {
                            "type": "text",
                            "text": "Describe how you could use a single array to implement three stacks. Reserve equal-capacity segments for each stack and maintain a top pointer per stack. Return a sentinel value for underflow conditions."
                        }
                    ]
                },
                {
                    "id": "code_example",
                    "title": "Code Example",
                    "content": [
                        {
                            "type": "code",
                            "name": "interview_lcci_03_01_three_in_one"
                        }
                    ]
                },
                {
                    "id": "example_output",
                    "title": "Example Output",
                    "content": [
                        {
                            "type": "text",
                            "text": "11"
                        },
                        {
                            "type": "text",
                            "text": "11"
                        },
                        {
                            "type": "text",
                            "text": "10"
                        },
                        {
                            "type": "text",
                            "text": "-1"
                        },
                        {
                            "type": "text",
                            "text": "false"
                        }
                    ]
                }
            ]
        }
    ]
}
