{
    "title": "Contiguous Sequence",
    "description": "Contiguous Sequence",
    "style": "text_style",
    "content": [
        {
            "type": "title",
            "text": "Contiguous Sequence"
        },
        {
            "type": "text",
            "text": "Contiguous Sequence"
        },
        {
            "type": "blocks",
            "blocks": [
                {
                    "id": "problem_statement",
                    "title": "Problem Statement",
                    "content": [
                        {
                            "type": "text",
                            "text": "See legacy docs: /legacy_content/docs/lcci/16/17_contiguous_sequence/README.md"
                        }
                    ]
                },
                {
                    "id": "example_cases",
                    "title": "Example Cases",
                    "content": [
                        {
                            "type": "text",
                            "text": "See example cases in the docs."
                        }
                    ]
                },
                {
                    "id": "code_example",
                    "title": "Code Example",
                    "content": [
                        {
                            "type": "code",
                            "name": "interview_lcci_16_17_contiguous_sequence"
                        }
                    ]
                }
            ]
        }
    ]
}
