{
    "title": "Bracket",
    "description": "Implement an algorithm to print all valid (e.g., properly opened and closed) combinations of n pairs of parentheses.",
    "style": "text_style",
    "content": [
        {
            "type": "title",
            "text": "Bracket"
        },
        {
            "type": "text",
            "text": "Implement an algorithm to print all valid (e.g., properly opened and closed) combinations of n pairs of parentheses."
        },
        {
            "type": "blocks",
            "blocks": [
                {
                    "id": "problem_statement",
                    "title": "Problem Statement",
                    "content": [
                        {
                            "type": "text",
                            "text": "Implement an algorithm to print all valid (e.g., properly opened and closed) combinations of n pairs of parentheses. **Example:** ``` Input: n = 3 Output: [\"((()))\",\"(()())\",\"(())()\", \"()(())\", \"()()()\"] ``` **Note:** `1 <= n <= 12`"
                        }
                    ]
                },
                {
                    "id": "code_example",
                    "title": "Code Example",
                    "content": [
                        {
                            "type": "code",
                            "name": "interview_lcci_08_09_bracket"
                        }
                    ]
                },
                {
                    "id": "example_output",
                    "title": "Example Output",
                    "content": [
                        {
                            "type": "text",
                            "text": "((()))"
                        },
                        {
                            "type": "text",
                            "text": "(()())"
                        },
                        {
                            "type": "text",
                            "text": "(())()"
                        },
                        {
                            "type": "text",
                            "text": "()(())"
                        },
                        {
                            "type": "text",
                            "text": "()()()"
                        }
                    ]
                }
            ]
        }
    ]
}
