{
    "title": "Continuous Median",
    "description": "Numbers are randomly generated and passed to a method.",
    "style": "text_style",
    "content": [
        {
            "type": "title",
            "text": "Continuous Median"
        },
        {
            "type": "text",
            "text": "Numbers are randomly generated and passed to a method."
        },
        {
            "type": "blocks",
            "blocks": [
                {
                    "id": "problem_statement",
                    "title": "Problem Statement",
                    "content": [
                        {
                            "type": "text",
                            "text": "Numbers are randomly generated and passed to a method. Write a program to find and maintain the median value as new values are generated. Implement `MedianFinder`: `addNum(num)` and `findMedian()`."
                        }
                    ]
                },
                {
                    "id": "code_example",
                    "title": "Code Example",
                    "content": [
                        {
                            "type": "code",
                            "name": "interview_lcci_17_20_continuous_median"
                        }
                    ]
                },
                {
                    "id": "example_output",
                    "title": "Example Output",
                    "content": [
                        {
                            "type": "text",
                            "text": "See problem output in legacy docs."
                        }
                    ]
                }
            ]
        }
    ]
}
