{
    "title": "Compress String",
    "description": "Perform basic string compression using run-length encoding, returning the original if compression offers no benefit.",
    "style": "text_style",
    "content": [
        {
            "type": "title",
            "text": "Compress String"
        },
        {
            "type": "text",
            "text": "Perform basic string compression using run-length encoding, returning the original if compression offers no benefit."
        },
        {
            "type": "blocks",
            "blocks": [
                {
                    "id": "problem_statement",
                    "title": "Problem Statement",
                    "content": [
                        {
                            "type": "text",
                            "text": "Implement a method to perform basic string compression using run-length encoding. For example, the string 'aabcccccaaa' would become 'a2b1c5a3'. If the compressed string would not become smaller than the original, return the original. Build the compressed output in one pass using two pointers to track runs."
                        }
                    ]
                },
                {
                    "id": "code_example",
                    "title": "Code Example",
                    "content": [
                        {
                            "type": "code",
                            "name": "interview_lcci_01_06_compress_string"
                        }
                    ]
                },
                {
                    "id": "example_output",
                    "title": "Example Output",
                    "content": [
                        {
                            "type": "text",
                            "text": "aabcccccaaa -> a2b1c5a3"
                        },
                        {
                            "type": "text",
                            "text": "abbccd -> abbccd"
                        }
                    ]
                }
            ]
        }
    ]
}
