{
    "title": "Palindrome Linked List",
    "description": "Check whether a singly linked list is a palindrome.",
    "style": "text_style",
    "content": [
        {
            "type": "title",
            "text": "Palindrome Linked List"
        },
        {
            "type": "text",
            "text": "Check whether a singly linked list is a palindrome."
        },
        {
            "type": "blocks",
            "blocks": [
                {
                    "id": "problem_statement",
                    "title": "Problem Statement",
                    "content": [
                        {
                            "type": "text",
                            "text": "Implement a function to check if a linked list is a palindrome. Use slow/fast pointers to locate the midpoint, reverse the second half in-place, and compare both halves node by node."
                        }
                    ]
                },
                {
                    "id": "code_example",
                    "title": "Code Example",
                    "content": [
                        {
                            "type": "code",
                            "name": "interview_lcci_02_06_palindrome_linked_list"
                        }
                    ]
                },
                {
                    "id": "example_output",
                    "title": "Example Output",
                    "content": [
                        {
                            "type": "text",
                            "text": "true"
                        },
                        {
                            "type": "text",
                            "text": "true"
                        }
                    ]
                }
            ]
        }
    ]
}
