{
    "title": "Eight Queens",
    "description": "Write an algorithm to print all ways of arranging n queens on an n×n chess board so that none of them share the same row, column, or diagonal.",
    "style": "text_style",
    "content": [
        {
            "type": "title",
            "text": "Eight Queens"
        },
        {
            "type": "text",
            "text": "Write an algorithm to print all ways of arranging n queens on an n×n chess board so that none of them share the same row, column, or diagonal."
        },
        {
            "type": "blocks",
            "blocks": [
                {
                    "id": "problem_statement",
                    "title": "Problem Statement",
                    "content": [
                        {
                            "type": "text",
                            "text": "Write an algorithm to print all ways of arranging n queens on an n×n chess board so that none of them share the same row, column, or diagonal. Write a method to return the arrangement as an array of strings. **Example:** ``` Input: n = 4 Output: [ [\".Q..\",\"...Q\",\"Q...\",\"..Q.\"], [\"..Q.\",\"Q...\",\"...Q\",\".Q..\"] ] ``` **Note:** `1 <= n <= 9`"
                        }
                    ]
                },
                {
                    "id": "code_example",
                    "title": "Code Example",
                    "content": [
                        {
                            "type": "code",
                            "name": "interview_lcci_08_12_eight_queens"
                        }
                    ]
                },
                {
                    "id": "example_output",
                    "title": "Example Output",
                    "content": [
                        {
                            "type": "text",
                            "text": "2 solutions"
                        },
                        {
                            "type": "text",
                            "text": ".Q.."
                        },
                        {
                            "type": "text",
                            "text": "...Q"
                        },
                        {
                            "type": "text",
                            "text": "Q..."
                        },
                        {
                            "type": "text",
                            "text": "..Q."
                        },
                        {
                            "type": "text",
                            "text": "..Q."
                        },
                        {
                            "type": "text",
                            "text": "Q..."
                        },
                        {
                            "type": "text",
                            "text": "...Q"
                        },
                        {
                            "type": "text",
                            "text": ".Q.."
                        }
                    ]
                }
            ]
        }
    ]
}
