{
    "title": "Word Transformer",
    "description": "Given two words of equal length that are in a dictionary, write a method to transform one word into another word by changing only one letter at a time.",
    "style": "text_style",
    "content": [
        {
            "type": "title",
            "text": "Word Transformer"
        },
        {
            "type": "text",
            "text": "Given two words of equal length that are in a dictionary, write a method to transform one word into another word by changing only one letter at a time."
        },
        {
            "type": "blocks",
            "blocks": [
                {
                    "id": "problem_statement",
                    "title": "Problem Statement",
                    "content": [
                        {
                            "type": "text",
                            "text": "Given two words of equal length that are in a dictionary, write a method to transform one word into another word by changing only one letter at a time. The new word you get in each step must be in the dictionary. Return each step in the transformation. Return null (or empty) if there is no such transformation."
                        }
                    ]
                },
                {
                    "id": "code_example",
                    "title": "Code Example",
                    "content": [
                        {
                            "type": "code",
                            "name": "interview_lcci_17_22_word_transformer"
                        }
                    ]
                },
                {
                    "id": "example_output",
                    "title": "Example Output",
                    "content": [
                        {
                            "type": "text",
                            "text": "See problem output in legacy docs."
                        }
                    ]
                }
            ]
        }
    ]
}
