{
    "title": "Lru Cache",
    "description": "Design and implement an LRU (least recently used) cache with `get` and `put` in O(1).",
    "style": "text_style",
    "content": [
        {
            "type": "title",
            "text": "Lru Cache"
        },
        {
            "type": "text",
            "text": "Design and implement an LRU (least recently used) cache with `get` and `put` in O(1)."
        },
        {
            "type": "blocks",
            "blocks": [
                {
                    "id": "problem_statement",
                    "title": "Problem Statement",
                    "content": [
                        {
                            "type": "text",
                            "text": "Design and implement an LRU (least recently used) cache with `get` and `put` in O(1)."
                        }
                    ]
                },
                {
                    "id": "code_example",
                    "title": "Code Example",
                    "content": [
                        {
                            "type": "code",
                            "name": "interview_lcci_16_25_lru_cache"
                        }
                    ]
                },
                {
                    "id": "example_output",
                    "title": "Example Output",
                    "content": [
                        {
                            "type": "text",
                            "text": "1"
                        },
                        {
                            "type": "text",
                            "text": "-1"
                        },
                        {
                            "type": "text",
                            "text": "-1"
                        },
                        {
                            "type": "text",
                            "text": "3"
                        },
                        {
                            "type": "text",
                            "text": "4"
                        }
                    ]
                }
            ]
        }
    ]
}
